ticker,date,time,headline,neg,neu,pos,compound,sentiment
fb,2018-09-19,10:17AM,Amazon to become the third largest digital ad platform in the U.S.,0.0,0.866,0.134,0.1779,pos
fb,2018-09-19,10:14AM,"These are the 10 most relevant brands to consumersFacebook, Twitter, Snapchat didn't make the list",0.0,1.0,0.0,0.0,neu
fb,2018-09-19,09:19AM,"FINAL DEADLINE ALERT: Brower Piven Reminds Shareholders Of Approaching Deadline In Class Action Lawsuit And Encourages Those Who Have Losses In Excess Of $100,000 From Investment In Facebook, Inc. (Nasdaq: FB) To Contact The Firm",0.111,0.748,0.141,0.3034,pos
fb,2018-09-19,07:40AM,Amazon makes headway in breaking up Facebook and Google's digital ad duopoly,0.0,0.866,0.134,0.1779,pos
fb,2018-09-19,06:00AM,"Amazon Increases Ad Market Share at Expense of Google, Facebook",0.0,0.672,0.328,0.4404,pos
fb,2018-09-18,08:20PM,[$$] Facebook and Financial Firms Tussled for Years Over Access to User Data,0.0,1.0,0.0,0.0,neu
fb,2018-09-18,08:20PM,[$$] Bertelsmann to Merge Unit That Moderates for Facebook With a Competitor,0.0,1.0,0.0,0.0,neu
fb,2018-09-18,07:12PM,Oregon using Facebook to remind inactive voters to register,0.0,1.0,0.0,0.0,neu
fb,2018-09-18,06:56PM,"The Law Offices of Howard G. Smith Reminds Investors of Looming Deadline in the Class Action Lawsuit Against Facebook, Inc. (FB)",0.152,0.848,0.0,-0.34,neg
fb,2018-09-18,06:47PM,Oregon using Facebook to remind inactive voters to register,0.0,1.0,0.0,0.0,neu
fb,2018-09-18,06:35PM,"The Law Offices of Howard G. Smith Reminds Investors of Looming Deadline in the Class Action Lawsuit Against Facebook, Inc. (FB)",0.152,0.848,0.0,-0.34,neg
fb,2018-09-18,05:43PM,Facebook accused of gender bias,0.545,0.455,0.0,-0.3818,neg
fb,2018-09-18,03:42PM,QAnon Is Trying to Trick Facebooks Meme-Reading AI,0.146,0.854,0.0,-0.0516,neg
fb,2018-09-18,03:14PM,Facebook accused of discriminating against women with targeted job adverts,0.196,0.804,0.0,-0.296,neg
fb,2018-09-18,03:11PM,Here's Another Way Facebook Can Monetize Instagram,0.0,1.0,0.0,0.0,neu
fb,2018-09-18,03:07PM,The Decline of Facebook Stock Has Created a Good Buying Opportunity,0.0,0.476,0.524,0.7717,pos
fb,2018-09-18,02:38PM,ACLU: Facebook allows gender-biased job ads on its platform,0.0,1.0,0.0,0.0,neu
fb,2018-09-18,02:36PM,Facebook Is JPMorgan's Most Controversial Company in Portfolio,0.23,0.77,0.0,-0.2716,neg
fb,2018-09-18,02:36PM,ACLU: Facebook allows gender-biased job ads on its platform,0.0,1.0,0.0,0.0,neu
fb,2018-09-18,02:05PM,Only One of These Media Stocks Is a Long-Term Buy on NFL Prospects,0.0,0.833,0.167,0.296,pos
fb,2018-09-18,02:00PM,ACLU Files Discrimination Complaint Against Facebook for Targeted Job Ads,0.196,0.804,0.0,-0.296,neg
fb,2018-09-18,01:54PM,Investors Pour Money Into This ETF Ahead of Index Reorganization,0.0,1.0,0.0,0.0,neu
fb,2018-09-18,01:40PM,The Tesla of China & the Facebook-Macy's Connection | Free Lunch,0.0,0.708,0.292,0.5106,pos
fb,2018-09-18,01:24PM,"Facebook Can't Settle One Ad Bias Claim, Gets Hit With Another",0.123,0.877,0.0,-0.1027,neg
fb,2018-09-18,01:24PM,"Facebook Can't Settle an Ad Bias Claim, Draws New Complaint",0.31,0.69,0.0,-0.3818,neg
fb,2018-09-18,01:00PM,"CLASS ACTION UPDATE for TSLA, RMTI and FB: Levi & Korsinsky, LLP Reminds Investors of Class Actions on Behalf of Shareholders",0.0,1.0,0.0,0.0,neu
fb,2018-09-18,12:50PM,Facebook Is Facing a Legal Battle with ACLU & CWA,0.257,0.594,0.149,-0.2732,neg
