ticker,date,time,headline,neg,neu,pos,compound,sentiment
tsla,2018-11-26,01:25PM,"Tesla was weeks from dying earlier this year, Elon Musk says",0.0,1.0,0.0,0.0,neu
tsla,2018-11-26,01:08PM,Elon Musk Says Tesla Was 'Close to Death' During Model 3 Ramp-Up,0.281,0.719,0.0,-0.5994,neg
tsla,2018-11-26,01:07PM,"Tesla Almost Died Earlier This Year, Says Elon Musk",0.292,0.708,0.0,-0.5118,neg
tsla,2018-11-26,01:00PM,Elon Musk Said Tesla Almost Died  and the Stock Market Shrugged,0.249,0.751,0.0,-0.5118,neg
tsla,2018-11-26,12:36PM,Elon Musk Admits Tesla Was Near Death This Year,0.298,0.534,0.168,-0.4019,neg
tsla,2018-11-26,11:54AM,Whatever Doesnt Kill Tesla Makes It Stranger,0.0,0.616,0.384,0.5773,pos
tsla,2018-11-26,10:21AM,Elon Musk: Tesla was weeks away from failure,0.32,0.68,0.0,-0.5106,neg
tsla,2018-11-26,09:30AM,"Company News For Nov 26, 2018",0.0,1.0,0.0,0.0,neu
tsla,2018-11-26,08:30AM,Musk Admits Tesla Was Close To Collapsing Earlier This Year Amid Model 3 Ramp,0.143,0.714,0.143,0.0,neu
tsla,2018-11-26,08:20AM,"What Tesla did for luxury cars, Rivian wants to do for pickups",0.0,1.0,0.0,0.0,neu
tsla,2018-11-26,08:20AM,General Motors to Close Operations at Canada's Oshawa Hub,0.0,1.0,0.0,0.0,neu
tsla,2018-11-26,08:11AM,"Stocks making the biggest move premarket: AMZN, WMT, M, TGT, GM, CPB & more",0.0,1.0,0.0,0.0,neu
tsla,2018-11-26,08:05AM,"Startups, old-line automakers aim to take bite out of Tesla",0.0,1.0,0.0,0.0,neu
tsla,2018-11-26,08:01AM,"What Tesla did for luxury cars, Rivian wants to do for pickups",0.0,1.0,0.0,0.0,neu
tsla,2018-11-26,08:01AM,"Startups, old-line automakers aim to take bite out of Tesla",0.0,1.0,0.0,0.0,neu
tsla,2018-11-26,07:54AM,Elon Musk admits Tesla was weeks from dying earlier in the year,0.0,0.833,0.167,0.296,pos
tsla,2018-11-26,06:33AM,Musk: Tesla was near death during Model 3 ramp-up,0.358,0.642,0.0,-0.5994,neg
tsla,2018-11-26,06:30AM,GM and Tesla lobby to raise electric vehicles tax credit ...,0.0,0.709,0.291,0.4019,pos
tsla,2018-11-25,08:53PM,[$$] Instant Gratification Is a Big Attraction,0.0,0.417,0.583,0.6808,pos
tsla,2018-11-25,07:05PM,Elon Musk: Tesla had 'single-digit weeks' as it teetered on brink of collapse,0.211,0.789,0.0,-0.4939,neg
tsla,2018-11-25,08:41AM,"Porsche Taycan to Drive Farther, Charge Faster",0.0,1.0,0.0,0.0,neu
tsla,2018-11-25,08:06AM,[$$] Tesla Is the Hot Spot for Young Job Seekers,0.0,1.0,0.0,0.0,neu
tsla,2018-11-23,09:09PM,Why Tesla Is Up 12% So Far in 2018,0.0,1.0,0.0,0.0,neu
tsla,2018-11-23,09:44AM,Tesla will cut prices in China in response to import tariffs; Reuters,0.16,0.84,0.0,-0.2732,neg
tsla,2018-11-23,09:37AM,"Oil Prices Pound Energy Stocks; Dow Jones Slips As Chips, Airlines Rally",0.0,0.84,0.16,0.2732,pos
tsla,2018-11-23,12:00AM,[$$] Robo-taxis or high-tech tunnels? The race for traffic utopia,0.0,1.0,0.0,0.0,neu
tsla,2018-11-22,08:23AM,Tesla Cuts China Car Prices: Can Others Survive Tariff Heat?,0.196,0.804,0.0,-0.296,neg
tsla,2018-11-22,03:55AM,[$$] Tesla cuts prices in China as trade war bites,0.433,0.567,0.0,-0.7269,neg
tsla,2018-11-22,01:24AM,Tesla Lowers Car Prices in China After Trade War Hits Demand,0.463,0.537,0.0,-0.7096,neg
tsla,2018-11-22,01:02AM,Tesla cuts China car prices to absorb hit from trade war tariffs,0.379,0.621,0.0,-0.7269,neg
tsla,2018-11-22,12:30AM,Tesla cuts China car prices to absorb hit from trade war tariffs,0.379,0.621,0.0,-0.7269,neg
tsla,2018-11-21,05:58PM,Is It Time to Buy Tesla (TSLA) Stock?,0.0,1.0,0.0,0.0,neu
tsla,2018-11-21,03:25PM,Tesla Stocks Surprising Resilience Is a Good Sign for Tesla Bulls,0.0,0.615,0.385,0.6124,pos
tsla,2018-11-21,12:55PM,Elon Musk says he's interested in developing cargo vans with Daimler,0.0,0.787,0.213,0.4019,pos
tsla,2018-11-21,12:22PM,Teslas Model 3 Takes First European Tour  But Not to Britain,0.0,1.0,0.0,0.0,neu
tsla,2018-11-21,11:49AM,SpaceX slashes first loan to $250 million,0.231,0.769,0.0,-0.2023,neg
tsla,2018-11-21,10:15AM,"Nasdaq Snaps Back, As This Retail Stock Soars On Strong Earnings",0.0,0.752,0.248,0.5106,pos
tsla,2018-11-21,09:39AM,First look: Inside Nio's growing San Jose HQ as it aims to win the car-tech talent war,0.155,0.516,0.329,0.5267,pos
tsla,2018-11-21,09:15AM,Guest Host Tonight,0.0,1.0,0.0,0.0,neu
tsla,2018-11-21,08:50AM,Increased Earnings Estimates Seen for Tesla (TSLA): Can It Move Higher?,0.0,0.826,0.174,0.2732,pos
tsla,2018-11-21,08:42AM,"Some Hedge Funds Are Crazy About Tesla, Inc. (TSLA)",0.231,0.769,0.0,-0.34,neg
tsla,2018-11-21,07:12AM,"Dow Jones Futures Try To Rebound; From Apple To Tesla, Five Reasons To Be In Cash Right Now",0.0,1.0,0.0,0.0,neu
tsla,2018-11-20,11:00PM,[$$] How Mate Rimac is supercharging electric cars,0.0,1.0,0.0,0.0,neu
tsla,2018-11-20,05:45PM,Tesla (TSLA) Stock Moves -1.69%: What You Should Know,0.0,1.0,0.0,0.0,neu
tsla,2018-11-20,04:45PM,"Elon Musks pot-smoking rankled NASA, sparking culture review at SpaceX and Boeing",0.0,1.0,0.0,0.0,neu
tsla,2018-11-20,03:58PM,"5 Must-See Stock Charts for Wednesday: TGT, KSS and TSLA",0.0,1.0,0.0,0.0,neu
tsla,2018-11-20,03:03PM,Follow Citron and Buy the Dip in Nvidia Stock,0.0,1.0,0.0,0.0,neu
tsla,2018-11-20,01:59PM,"Teslas battery is cheaper than the competitions, UBS says",0.0,1.0,0.0,0.0,neu
tsla,2018-11-20,01:00PM,Will Tesla Partner With Mercedes for a New Vehicle?,0.0,1.0,0.0,0.0,neu
tsla,2018-11-20,12:11PM,The Rally In Tesla Stock Has Stalled Out  Again,0.184,0.816,0.0,-0.2023,neg
tsla,2018-11-20,10:59AM,3 Catalysts Investors Should See Before Going Long GE Stock,0.0,1.0,0.0,0.0,neu
tsla,2018-11-20,10:43AM,7 Winning Stocks to Buy in November for 2019,0.0,0.673,0.327,0.5267,pos
tsla,2018-11-20,09:52AM,Tesla Plans to Double Supercharger Network Size in 2019,0.0,1.0,0.0,0.0,neu
tsla,2018-11-20,09:02AM,"Neil deGrasse Tyson: Elon Musk is more important than Jeff Bezos, Mark Zuckerberg and Steve Jobs",0.0,0.878,0.122,0.2716,pos
tsla,2018-11-20,08:19AM,"The Zacks Analyst Blog Highlights: Peabody Energy, First Solar, General Motors, Ford Motor and Tesla",0.0,0.87,0.13,0.2732,pos
tsla,2018-11-19,09:02PM,[$$] Tesla batteries prove best value in class  UBS,0.0,0.515,0.485,0.765,pos
tsla,2018-11-19,05:07PM,"Ford, Zayo Group, Nio Sidestep Selloff",0.0,1.0,0.0,0.0,neu
tsla,2018-11-19,04:55PM,Boring Co. drill breaks through to the other side,0.223,0.777,0.0,-0.3182,neg
tsla,2018-11-19,04:00PM,Elon Musk Teases 'Radical Change' To Massive New SpaceX Rocket,0.196,0.804,0.0,-0.296,neg
tsla,2018-11-19,03:44PM,Tesla partners with outside companies to sell used cars: report,0.0,1.0,0.0,0.0,neu
tsla,2018-11-19,02:57PM,Tesla is turning to partners to help with a growing used-car business,0.0,0.672,0.328,0.5267,pos
tsla,2018-11-19,01:36PM,Stock Market News: Tesla Breakout Fades As FAANG Stocks Slammed Again,0.0,1.0,0.0,0.0,neu
tsla,2018-11-19,12:38PM,Musk hints at Tesla interest in Daimler van,0.0,0.7,0.3,0.4588,pos
tsla,2018-11-19,12:26PM,Musk hints at Tesla interest in Daimler van,0.0,0.7,0.3,0.4588,pos
tsla,2018-11-19,11:57AM,Citron Research: Nio Is 'Tesla Deja Vu',0.0,1.0,0.0,0.0,neu
tsla,2018-11-19,11:56AM,Stocks Widen Losses; Dow Jones Fails To Keep Friday's Gain,0.346,0.44,0.214,-0.2732,neg
tsla,2018-11-19,11:23AM,How Low Can Facebook Stock Go?,0.296,0.704,0.0,-0.2732,neg
tsla,2018-11-19,10:33AM,Nissan Sacks Chairman Carlos Ghosn,0.0,1.0,0.0,0.0,neu
tsla,2018-11-19,10:24AM,Nissan (NSANY) Boss Arrested in Tokyo,0.383,0.617,0.0,-0.4767,neg
tsla,2018-11-19,10:18AM,Tech Stocks Lower As Apple Cuts iPhone Production; Tesla Breaks Out,0.328,0.672,0.0,-0.5267,neg
tsla,2018-11-19,09:30AM,Is Tesla (TSLA) Outperforming Other Auto-Tires-Trucks Stocks This Year?,0.0,1.0,0.0,0.0,neu
tsla,2018-11-19,08:56AM,4 Industries in Focus as Oil Prices May Edge Up,0.0,1.0,0.0,0.0,neu
tsla,2018-11-19,08:33AM,Copart (CPRT) to Report Q1 Earnings: What's in the Offing?,0.0,1.0,0.0,0.0,neu
tsla,2018-11-19,06:55AM,Todays Research Reports on Stocks to Watch: Ford and Tesla,0.0,1.0,0.0,0.0,neu
tsla,2018-11-18,11:05AM,"Tesla, PayPal Lead 5 Top Stocks Near Buy Points In This Classic Bullish Pattern",0.0,0.87,0.13,0.2023,pos
tsla,2018-11-18,10:00AM,Stock Market Power Rankings: Apple's $190 Billion Haircut,0.0,1.0,0.0,0.0,neu
tsla,2018-11-18,08:18AM,Why NIO Is Up 18% So Far in 2018,0.0,1.0,0.0,0.0,neu
tsla,2018-11-17,01:19PM,"You Can Still Get a Tesla Model 3 in Time to Qualify for $7,500 Tax Credit",0.0,0.833,0.167,0.3818,pos
tsla,2018-11-17,06:00AM,Morningstar Runs the Numbers,0.0,1.0,0.0,0.0,neu
tsla,2018-11-16,06:50PM,Cramer's lightning round: Don't buy shares of Target until after it reports,0.146,0.854,0.0,-0.2235,neg
tsla,2018-11-16,04:27PM,Tesla has opened up Model 3 orders to customers in China,0.0,1.0,0.0,0.0,neu
tsla,2018-11-16,04:20PM,David Einhorn's Top 4 Sells in 3rd Quarter,0.0,0.769,0.231,0.2023,pos
tsla,2018-11-16,02:46PM,Tesla Ramps Up Its International Expansion for Model 3,0.0,1.0,0.0,0.0,neu
tsla,2018-11-16,02:12PM,7 Autonomous Vehicle Stocks to Consider Now,0.0,1.0,0.0,0.0,neu
tsla,2018-11-16,02:00PM,Tesla's Breakout May Boost Stock Near Its Record High,0.0,0.748,0.252,0.4019,pos
tsla,2018-11-16,12:14PM,"Gene Munster Talks Apple, Amazon-Target, Tesla On PreMarket Prep",0.0,1.0,0.0,0.0,neu
tsla,2018-11-16,11:59AM,Tesla starts taking Model 3 orders in China,0.0,1.0,0.0,0.0,neu
tsla,2018-11-16,10:19AM,Tesla starts Model 3 orders in China,0.0,1.0,0.0,0.0,neu
tsla,2018-11-16,10:13AM,Tesla starts Model 3 orders in China,0.0,1.0,0.0,0.0,neu
tsla,2018-11-16,09:52AM,"Report: Tesla is weeks away from hitting 7,000-Model 3s-per-week production milestone",0.0,1.0,0.0,0.0,neu
tsla,2018-11-16,09:20AM,"Forget Tesla, Inc.: Albemarle Corporation Is a Better Electric-Vehicle Stock",0.161,0.593,0.246,0.25,pos
tsla,2018-11-16,09:04AM,Tesla Is Prepared for a Big Fourth Quarter,0.0,0.759,0.241,0.2263,pos
tsla,2018-11-16,08:56AM,VW to Spend $50 Billion on New Tech to Take On Rivals,0.0,1.0,0.0,0.0,neu
tsla,2018-11-16,08:35AM,Elon Musk's SpaceX Gets Nod for Satellite-Based Internet,0.0,1.0,0.0,0.0,neu
tsla,2018-11-16,08:32AM,"Stocks making the biggest move premarket: FB, NVDA, PCG, JWN & more",0.0,1.0,0.0,0.0,neu
tsla,2018-11-16,08:31AM,VW says could build up to 15 million electric cars,0.0,1.0,0.0,0.0,neu
tsla,2018-11-16,08:12AM,Elon Musk to Prowl Production Lines in Push for Model 3 Milestone,0.0,1.0,0.0,0.0,neu
tsla,2018-11-16,06:39AM,Tesla cuts prices on solar power systems as it looks to entice customers,0.155,0.845,0.0,-0.296,neg
tsla,2018-11-16,06:00AM,Tesla Stretch Pushes Customers to Open Wallets for Model 3s,0.0,1.0,0.0,0.0,neu
tsla,2018-11-16,05:00AM,Meet the man who runs Teslas Gigafactory 2 in Buffalo,0.0,1.0,0.0,0.0,neu
fb,2019-01-04,06:22PM,"Facebook, Apple, Netflix, Amazon and Alphabet Power Friday Gains",0.0,0.631,0.369,0.4767,pos
fb,2019-01-04,05:15PM,"Earnings Reports for the Week of Jan. 7-11 (BBBY, KBH)",0.0,1.0,0.0,0.0,neu
fb,2019-01-04,04:55PM,COLUMN-Commentary: 2019 will be the year of more state control,0.0,1.0,0.0,0.0,neu
fb,2019-01-04,04:53PM,3 Tech Trends to Watch in 2019,0.0,1.0,0.0,0.0,neu
fb,2019-01-04,04:30PM,Will Denver's tech growth continue in 2019?,0.0,0.698,0.302,0.3818,pos
fb,2019-01-04,02:46PM,Facebook to Prioritize Video in 2019,0.0,1.0,0.0,0.0,neu
fb,2019-01-04,01:52PM,ScotteVest CEO: How a Facebook Passion Project Evolved into a New Business,0.0,0.75,0.25,0.4588,pos
fb,2019-01-04,01:47PM,"Millennials Load Up on Battered Apple, Facebook, GE",0.0,1.0,0.0,0.0,neu
fb,2019-01-04,01:00PM,FAANGs See a Weak Start to 2019: More Pain Ahead for ETFs?,0.419,0.581,0.0,-0.7574,neg
fb,2019-01-04,12:18PM,U[PDATE: Netflix shares soar 9% as Goldman adds stock to its Conviction List,0.0,0.845,0.155,0.296,pos
fb,2019-01-04,12:11PM,What Strategy Should Stock Pickers Use in 2019?,0.0,1.0,0.0,0.0,neu
fb,2019-01-04,11:54AM,7 Tech Stocks Without China Exposure,0.0,1.0,0.0,0.0,neu
fb,2019-01-04,11:08AM,Amazon (AMZN) Faces Strike Hurdles Before Epiphany in Spain,0.147,0.686,0.167,0.0516,pos
fb,2019-01-04,10:16AM,Apples stock price wont recover and 9 more bold predictions for 2019,0.0,0.776,0.224,0.4391,pos
fb,2019-01-04,10:06AM,Facebook Earnings: Mark Your Calendar,0.0,1.0,0.0,0.0,neu
fb,2019-01-04,10:03AM,RBC's Mahaney: Tech 'Reckoning' Already Occurred,0.0,1.0,0.0,0.0,neu
fb,2019-01-04,09:28AM,Mark Zuckerberg hits pause on his plan to sell billions of dollars worth of Facebook stock,0.0,0.888,0.112,0.2263,pos
fb,2019-01-04,08:35AM,Social Media ETF Stung By Analyst Downgrades,0.0,1.0,0.0,0.0,neu
fb,2019-01-04,08:33AM,Twitter Still Vulnerable to Hacking by Terrorist Groups,0.524,0.476,0.0,-0.765,neg
fb,2019-01-04,06:00AM,Apple vs. Facebook. Whos Had the Worse Run?,0.307,0.693,0.0,-0.4767,neg
fb,2019-01-04,05:26AM,Facebook Rises 3%,0.0,1.0,0.0,0.0,neu
fb,2019-01-03,10:59PM,[$$] Facebook Begins New Year in Fixer-Upper Mode,0.0,1.0,0.0,0.0,neu
fb,2019-01-03,05:45PM,Investors Are Focused Too Closely on Facebook and Google's Market Share,0.0,0.652,0.348,0.5859,pos
fb,2019-01-03,05:32PM,[$$] Facebook Begins New Year in Fixer-Upper Mode,0.0,1.0,0.0,0.0,neu
fb,2019-01-03,05:24PM,Facebook (FB) Reportedly Testing Dark Mode on Messenger,0.0,1.0,0.0,0.0,neu
fb,2019-01-03,04:10PM,"Google Stock Upgraded, Viewed As 'Most Defensive' FANG Amid Tech Sell-Off",0.0,0.878,0.122,0.101,pos
fb,2019-01-03,03:26PM,Is Facebook Stock the Best FANG Stock to Buy?,0.0,0.656,0.344,0.6369,pos
fb,2019-01-03,03:14PM,"Zuckerberg Paused His Selling of Facebook Shares, Analysts Say It's a Good Sign",0.0,0.662,0.338,0.6249,pos
fb,2019-01-03,01:36PM,What's Next For Apple (AAPL) After It Slashed Its Q1 Sales Forecast?,0.147,0.853,0.0,-0.2263,neg
fb,2019-01-03,01:31PM,Take the Money And Run From Twilio Stock,0.0,1.0,0.0,0.0,neu
fb,2019-01-03,12:25PM,3 Great Reasons You Should Be Bullish on Twilio Stock,0.0,0.661,0.339,0.6249,pos
fb,2019-01-03,10:42AM,Why Netflix Stock Will Rise Back Above $300 In 2019,0.0,1.0,0.0,0.0,neu
fb,2019-01-03,10:21AM,Facebook Under Fire for Collecting Data From Android Apps,0.231,0.769,0.0,-0.34,neg
fb,2019-01-03,10:08AM,Mark Zuckerberg Halts Stock Sales as Facebook Shares Tumble,0.0,0.784,0.216,0.296,pos
fb,2019-01-03,09:58AM,Facebook Falls 3%,0.981,0.019,0.0,-0.9993,neu
fb,2019-01-03,09:48AM,"Stock Market News For Jan 3, 2019",0.0,1.0,0.0,0.0,neu
fb,2019-01-03,09:34AM,Apple warning stoking fears of slowdown in Chinese econom...,0.426,0.574,0.0,-0.6369,neg
fb,2019-01-03,09:12AM,Why The FAANGs Are Crucial To A 2019 Market Rally,0.0,1.0,0.0,0.0,neu
fb,2019-01-03,09:07AM,"The Zacks Analyst Blog Highlights: Facebook, Wells Fargo, AT&T, Intel and Glaxo",0.0,0.846,0.154,0.25,pos
fb,2019-01-03,08:04AM,"3 Big Stock Charts for Thursday: Medtronic, Facebook and eBay",0.0,1.0,0.0,0.0,neu
fb,2019-01-03,06:00AM,Why Internet Censorship Doesnt Work and Never Will,0.0,1.0,0.0,0.0,neu
fb,2019-01-02,10:35PM,Technology Stocks: Should You Bail?,0.0,1.0,0.0,0.0,neu
fb,2019-01-02,06:46PM,Here's Why Facebook (FB) Stock Looks Like a Buy,0.0,0.737,0.263,0.3612,pos
fb,2019-01-02,05:16PM,New Guru Philippe Laffont's Top 5 Holdings,0.0,0.735,0.265,0.2023,pos
fb,2019-01-02,04:14PM,Should Mark Zuckerberg step away from Facebook?,0.0,1.0,0.0,0.0,neu
fb,2019-01-02,04:05PM,Facebook to Announce Fourth Quarter and Full Year 2018 Results,0.0,1.0,0.0,0.0,neu
fb,2019-01-02,02:25PM,Mighty FAANG Stocks No Longer A Sure Bet For 2019 Stock Year,0.163,0.667,0.17,0.0258,pos
fb,2019-01-02,02:15PM,This Chart Implies That Google Stock Is Due for a 20% Rally,0.0,1.0,0.0,0.0,neu
fb,2019-01-02,01:36PM,Will Insiders Be Buying Stocks in 2019?,0.0,1.0,0.0,0.0,neu
fb,2019-01-02,12:10PM,Stock Market News: Nasdaq Pares 1.9% Intraday Loss As Chip Stocks Lead,0.173,0.827,0.0,-0.3182,neg
fb,2019-01-02,11:01AM,3 Reasons Why Google Stock Is a FANG You Can Trust,0.0,0.708,0.292,0.5106,pos
fb,2019-01-02,10:16AM,Netflix Stocks Bull Case Looks Even Stronger,0.0,0.698,0.302,0.3818,pos
fb,2019-01-02,10:12AM,"Warren Buffett Stocks: Who Joins Nvidia, Alibaba, Facebook On This Screen?",0.0,1.0,0.0,0.0,neu
fb,2019-01-02,09:53AM,"Apple, Amazon sell-off overdone, research analyst says",0.0,0.779,0.221,0.1779,pos
fb,2019-01-02,09:38AM,Stocks Dive As China Tariffs Bite; Dow Jones Drops 350 Points,0.0,1.0,0.0,0.0,neu
fb,2019-01-02,09:30AM,3 Reasons Why I Bought Stocks on Monday,0.0,1.0,0.0,0.0,neu
fb,2019-01-02,08:53AM,Oversold Facebook Stock Set for Big Bounce,0.0,1.0,0.0,0.0,neu
fb,2019-01-02,08:27AM,Top 5 ROE Stocks to Invest in Now to Beat Market Blues,0.0,0.847,0.153,0.2023,pos
fb,2019-01-02,08:13AM,[$$] Cyber Daily: CEOs Must Step Up,0.0,1.0,0.0,0.0,neu
fb,2019-01-02,07:51AM,Facebook Messenger tests Dark Mode to put less strain on users' eyes,0.0,0.91,0.09,0.024,pos
fb,2019-01-02,07:09AM,"During the Holidays, Unfriend Irksome Relatives at Your Own Risk",0.165,0.63,0.205,0.128,pos
fb,2019-01-02,06:12AM,Facebook Rises 3%,0.0,1.0,0.0,0.0,neu
fb,2019-01-01,10:48PM,Google wins U.S. approval for radar-based hand motion sensor,0.0,0.375,0.625,0.875,pos
fb,2019-01-01,09:21AM,20 Realistic Tech Predictions for 2019 -- Part Two,0.0,1.0,0.0,0.0,neu
fb,2019-01-01,12:00AM,2018: A Year in Review for a Roller-Coaster Market,0.0,1.0,0.0,0.0,neu
fb,2018-12-31,05:51PM,Facebooks Mark Zuckerberg lost $22 billion in 2018: Report,0.223,0.777,0.0,-0.3182,neg
fb,2018-12-31,04:01PM,Facebook's worst year ever is now over. Here's how its scandals affected the stock,0.447,0.553,0.0,-0.836,neg
fb,2018-12-31,04:01PM,A year ago the FAANG stocks were a hot buy  here's where they stand heading into 2019,0.0,1.0,0.0,0.0,neu
fb,2018-12-31,02:53PM,Netflix Rises as 2018 FAANG Leader Closes Out Year With a Rally,0.0,1.0,0.0,0.0,neu
fb,2018-12-31,01:59PM,"Facebook Falls Midday, Bringing Communication Services Index Down",0.935,0.065,0.0,-0.9993,neu
fb,2018-12-31,11:41AM,Expert: It's likely the US will see a data privacy law in...,0.0,1.0,0.0,0.0,neu
fb,2018-12-31,11:34AM,Tech had a rocky 2018. Here's what 2019 might look like.,0.0,0.783,0.217,0.3612,pos
fb,2018-12-31,11:16AM,Recode's Kara Swisher lays out 2019 tech predictions,0.0,1.0,0.0,0.0,neu
fb,2018-12-31,10:35AM,Why the Worst May Be Over for Tencent Stock,0.339,0.661,0.0,-0.6249,neg
fb,2018-12-31,10:31AM,Facebook Stock Finally Has Found the Bottom and Will Build a Great 2019,0.0,0.728,0.272,0.6249,pos
fb,2018-12-31,10:23AM,"Venture investing in 2018: Seed deals, Saudis, scooters and more",0.0,1.0,0.0,0.0,neu
fb,2018-12-31,09:04AM,Twitter Accounts Get Hacked for Demo to Reveal Security Gaps,0.206,0.611,0.183,-0.0772,neg
fb,2018-12-31,08:00AM,Better Buy: Facebook vs. Twitter,0.0,0.58,0.42,0.4404,pos
fb,2018-12-31,07:30AM,Maxim analyst expects tech rally in 2019,0.0,1.0,0.0,0.0,neu
fb,2018-12-31,07:06AM,Android apps sharing data with Facebook without users' consent: Report,0.134,0.642,0.225,0.281,pos
fb,2018-12-30,08:00PM,It Looks Like Verizon's Online Advertising Project Is a Flop,0.202,0.588,0.21,0.0258,pos
fb,2018-12-30,05:45PM,Did Facebook Just Become the Best Way to Invest in Blockchain?,0.0,0.704,0.296,0.6369,pos
fb,2018-12-30,04:30PM,Facebook Chases Square Into the Peer-to-Peer Crypto Market,0.0,1.0,0.0,0.0,neu
fb,2018-12-30,03:39PM,"Benzinga's Bulls & Bears Of The Week: Amazon, Apple, Disney, Facebook, GM And More",0.0,0.876,0.124,0.1779,pos
fb,2018-12-30,03:23PM,Think Snap Is a Bargain? Think Again.,0.0,0.735,0.265,0.2023,pos
fb,2018-12-30,02:10PM,A look back at the most read Bay Area business news of 2018,0.0,1.0,0.0,0.0,neu
fb,2018-12-29,07:00PM,Half a Billion Millennial Voters Are Face of Asia 2019,0.0,1.0,0.0,0.0,neu
fb,2018-12-29,04:43PM,"Tech Stocks This Week: Amazon's Big Holiday, A Bullish Call on Facebook, and More",0.0,0.816,0.184,0.4019,pos
fb,2018-12-29,07:00AM,Facebook has been thinking about moderation all wrong,0.307,0.693,0.0,-0.4767,neg
fb,2018-12-28,10:58PM,Year in Review 3: Reckless Predictions and Stocks to Watch in 2019,0.197,0.803,0.0,-0.4019,neg
fb,2018-12-28,05:50PM,Facebook (FB) Struggles to Regulate Content on Its Platform,0.238,0.762,0.0,-0.3612,neg
fb,2018-12-28,04:34PM,Facebook might need to undergo 'fundamental change' in or...,0.0,1.0,0.0,0.0,neu
fb,2018-12-28,04:13PM,"Markets End Tumultuous Day in the Red, Mini-Rally Ends at 2 Sessions",0.0,1.0,0.0,0.0,neu
fb,2018-12-28,04:09PM,Regaining Trust Is the No. 1 Issue for Tech in 2019,0.163,0.593,0.244,0.2732,pos
fb,2018-12-28,03:17PM,Facebook under fire over secret rulebook,0.324,0.676,0.0,-0.34,neg
fb,2018-12-28,02:57PM,Accidental Instagram Update of Horizontal Scrolling Causes Uproar,0.157,0.843,0.0,-0.0772,neg
fb,2018-12-28,02:44PM,Zuckerberg Claims Facebook Has 'Fundamentally Altered' Its DNA,0.0,1.0,0.0,0.0,neu
fb,2018-12-28,01:46PM,Facebook CEO Zuckerberg Says Problems Will Take Years to Fix,0.231,0.769,0.0,-0.4019,neg
fb,2018-12-28,01:30PM,Zuckerberg: Facebook can never fully stop use of platform for election meddling,0.0,0.839,0.161,0.2743,pos
fb,2018-12-28,11:35AM,Why Investors Should Avoid Snap Stock,0.306,0.694,0.0,-0.296,neg
tsla,2019-01-04,08:36PM,Why Tesla Stock Popped 6%,0.0,1.0,0.0,0.0,neu
tsla,2019-01-04,07:42PM,Tesla urges tariff exemption for Chinese-made car computer 'brain',0.0,1.0,0.0,0.0,neu
tsla,2019-01-04,07:17PM,Tesla urges tariff exemption for Chinese-made car computer 'brain',0.0,1.0,0.0,0.0,neu
tsla,2019-01-04,07:07PM,Tesla urges tariff exemption for Chinese-made car computer 'brain',0.0,1.0,0.0,0.0,neu
tsla,2019-01-04,06:19PM,Elon Musk Isnt Keen on Investors Dragging Girlfriend Into Tweet Lawsuit,0.308,0.692,0.0,-0.4606,neg
tsla,2019-01-04,06:02PM,"CNBC Tech Check Evening Edition: January 04, 2019",0.0,1.0,0.0,0.0,neu
tsla,2019-01-04,04:26PM,"Tesla Ready To Deliver Model 3 Vehicles To China, Europe",0.0,0.762,0.238,0.3612,pos
tsla,2019-01-04,04:06PM,"Stock Market Rally Extends On Fed Chairman Powell, Jobs; Apple, Tesla, Delta Disappoint; Bristol-Myers Buys Celgene: Weekly Review",0.134,0.792,0.074,-0.296,neg
tsla,2019-01-04,03:56PM,Buy Tesla (TSLA) Stock in 2019 on International Model 3 Expansion?,0.0,1.0,0.0,0.0,neu
tsla,2019-01-04,12:32PM,AT&T Stock Still Is One of the Best Downturn Plays,0.0,0.563,0.437,0.7351,pos
tsla,2019-01-04,11:50AM,Tesla and GM Are Watching Their Federal Tax Credits Dwindle,0.0,0.783,0.217,0.3612,pos
tsla,2019-01-04,11:48AM,Tesla to start delivering Model 3 to China buyers in March,0.0,1.0,0.0,0.0,neu
tsla,2019-01-04,11:46AM,Longtime Tesla Bear Still Expects A Sharp Valuation Plunge,0.0,1.0,0.0,0.0,neu
tsla,2019-01-04,11:07AM,Elon Musk wants to keep ex-girlfriend Grimes out of an investor lawsuit over his take-private tweet,0.218,0.782,0.0,-0.4404,neg
tsla,2019-01-04,10:16AM,Apples stock price wont recover and 9 more bold predictions for 2019,0.0,0.776,0.224,0.4391,pos
tsla,2019-01-04,10:00AM,Tesla's biggest bear says stock will tank 70 percent in 2019,0.0,1.0,0.0,0.0,neu
tsla,2019-01-04,09:27AM,The Tesla Model Y will be unveiled this year  here are the latest updates,0.0,1.0,0.0,0.0,neu
tsla,2019-01-04,09:19AM,Tesla opens up Model 3 configuration to left-hand drive European countries,0.0,1.0,0.0,0.0,neu
tsla,2019-01-04,09:00AM,Musk Deletes Tweet Sharing Incorrect Report of Tesla Sales Win,0.0,0.548,0.452,0.765,pos
tsla,2019-01-04,08:55AM,Tesla's not-so-happy start to the new year,0.0,1.0,0.0,0.0,neu
tsla,2019-01-04,08:22AM,Truckin': Auto Sales Pivot Away From Cars In 2018,0.0,1.0,0.0,0.0,neu
tsla,2019-01-04,08:10AM,German annual car sales fall 0.2 percent as diesel bans dampen demand,0.12,0.88,0.0,-0.128,neg
tsla,2019-01-04,08:09AM,German annual car sales fall 0.2 pct as diesel bans dampen demand,0.12,0.88,0.0,-0.128,neg
tsla,2019-01-04,07:55AM,Tesla to Begin Model 3 Deliveries to China Customers in March,0.0,1.0,0.0,0.0,neu
tsla,2019-01-04,07:17AM,"Stocks making the biggest moves premarket: LUV, TSLA, NFLX, INTC & more",0.0,1.0,0.0,0.0,neu
tsla,2019-01-04,07:08AM,"Jobs Report, Jerome Powell, Apple, Tesla, Trade Talks - 5 Things You Must Know",0.0,1.0,0.0,0.0,neu
tsla,2019-01-04,07:00AM,Today's Research Reports on Trending Tickers: General Motors and Tesla,0.0,1.0,0.0,0.0,neu
tsla,2019-01-04,06:58AM,"Tesla delivery numbers reveal little about the future, unless you want them to",0.0,0.902,0.098,0.0772,pos
tsla,2019-01-04,12:01AM,Tesla Is Close to Model 3 Approval for Europe Sales,0.0,0.721,0.279,0.4767,pos
tsla,2019-01-03,10:06PM,Tesla's Musk Says Singapore Government Has Been Unwelcoming,0.0,1.0,0.0,0.0,neu
tsla,2019-01-03,06:20PM,"Tesla stock drops over missed delivery estimates, price cuts",0.386,0.614,0.0,-0.5267,neg
tsla,2019-01-03,05:44PM,Tesla Down Almost 10% in 2019 Despite Model 3 Cracking Top 5 in Sedan Sales,0.117,0.883,0.0,-0.1511,neg
tsla,2019-01-03,05:23PM,"Born with 'gasoline in his blood,' GM's Reuss adds president to long list of duties",0.0,1.0,0.0,0.0,neu
tsla,2019-01-03,05:15PM,"SpaceX confirms its raising $500 million, still lists Steve Jurvetson as board member",0.0,1.0,0.0,0.0,neu
tsla,2019-01-03,04:11PM,"Space Taxis, Air Taxis, Robotaxis Make 2019 A Pivotal Year In Mobility",0.0,1.0,0.0,0.0,neu
tsla,2019-01-03,04:11PM,Heres What Analysts Said After Teslas Price Cut Announcement,0.208,0.792,0.0,-0.2732,neg
tsla,2019-01-03,04:09PM,"GM U.S. Sales Fall 2.7% In Q4; Ford, Fiat Chrysler Beat In December",0.0,1.0,0.0,0.0,neu
tsla,2019-01-03,03:08PM,AP Explains: What Tesla price cuts mean for demand,0.346,0.654,0.0,-0.4019,neg
tsla,2019-01-03,03:05PM,Government shutdown may threaten SpaceXs unmanned Crew Dragon demo,0.245,0.755,0.0,-0.3818,neg
tsla,2019-01-03,02:50PM,"Analysts Tackle Tesla Price Cut, Demand Concerns",0.419,0.581,0.0,-0.3818,neg
tsla,2019-01-03,11:42AM,What Is Artificial Intelligence? Examples and News in 2019,0.0,0.721,0.279,0.4767,pos
tsla,2019-01-03,11:41AM,Detroit Auto Show will be 'all you can eat buffet of prof...,0.0,1.0,0.0,0.0,neu
tsla,2019-01-03,11:40AM,Could Tesla price cuts mean demand is slowing?,0.381,0.619,0.0,-0.4019,neg
tsla,2019-01-03,09:51AM,"Company News For Jan 3, 2019",0.0,1.0,0.0,0.0,neu
tsla,2019-01-03,09:27AM,Tesla Stock Doomsayers Are Wrong About the Q4 Delivery Update,0.42,0.58,0.0,-0.7003,neg
